{
  "$defs": {
    "ReviewItem": {
      "additionalProperties": false,
      "properties": {
        "details": {
          "items": {
            "type": "string"
          },
          "title": "Details",
          "type": "array"
        },
        "document_id": {
          "minLength": 1,
          "title": "Document Id",
          "type": "string"
        },
        "reasons": {
          "items": {
            "type": "string"
          },
          "minItems": 1,
          "title": "Reasons",
          "type": "array"
        },
        "schema_version": {
          "const": "2.0",
          "title": "Schema Version",
          "type": "string"
        },
        "source_relpath": {
          "title": "Source Relpath",
          "type": "string"
        }
      },
      "required": [
        "schema_version",
        "document_id",
        "source_relpath",
        "reasons"
      ],
      "title": "ReviewItem",
      "type": "object"
    }
  },
  "$schema": "https://json-schema.org/draft/2020-12/schema",
  "additionalProperties": false,
  "properties": {
    "generated_at": {
      "minLength": 1,
      "title": "Generated At",
      "type": "string"
    },
    "items": {
      "items": {
        "$ref": "#/$defs/ReviewItem"
      },
      "title": "Items",
      "type": "array"
    },
    "run_id": {
      "minLength": 1,
      "title": "Run Id",
      "type": "string"
    },
    "schema_version": {
      "const": "2.0",
      "title": "Schema Version",
      "type": "string"
    }
  },
  "required": [
    "schema_version",
    "run_id",
    "generated_at",
    "items"
  ],
  "title": "ReviewManifest",
  "type": "object"
}
