{
  "generated_at": "2026-07-21T17:23:12.458739-05:00",
  "items": [
    {
      "details": [
        "Revisar advertencias de extracción antes de indexar."
      ],
      "document_id": "doc_864d906c5eae1183",
      "reasons": [
        "classification_conflict"
      ],
      "schema_version": "2.0",
      "source_relpath": "convivencia_laboral/manual/1761580555950_syc_RE.RH-04SST23102025.pdf"
    },
    {
      "details": [
        "Revisar advertencias de extracción antes de indexar."
      ],
      "document_id": "doc_caf88d615e56edd4",
      "reasons": [
        "conflicting_code",
        "classification_conflict"
      ],
      "schema_version": "2.0",
      "source_relpath": "convivencia_laboral/manual/1781045303349_syc_politicadedesconexin.pdf"
    },
    {
      "details": [
        "Revisar advertencias de extracción antes de indexar."
      ],
      "document_id": "doc_d57d21ff836e1ec0",
      "reasons": [
        "classification_conflict"
      ],
      "schema_version": "2.0",
      "source_relpath": "convivencia_laboral/manual/1781045390931_syc_politicadeprevencind.pdf"
    },
    {
      "details": [
        "Revisar advertencias de extracción antes de indexar."
      ],
      "document_id": "doc_d4fca71ff51cb27b",
      "reasons": [
        "classification_conflict"
      ],
      "schema_version": "2.0",
      "source_relpath": "convivencia_laboral/reglamento_comite/1761609513260_syc_RG.RH-01-SST23102025.pdf"
    },
    {
      "details": [
        "Revisar advertencias de extracción antes de indexar."
      ],
      "document_id": "doc_f2cf7868a801af0e",
      "reasons": [
        "classification_conflict"
      ],
      "schema_version": "2.0",
      "source_relpath": "general_sst/capacitaciones/pausas_activas/1711493199040_syc_pg-rh-10-sst.program.pdf"
    },
    {
      "details": [
        "Revisar advertencias de extracción antes de indexar."
      ],
      "document_id": "doc_3e55236f58440bf5",
      "reasons": [
        "classification_conflict"
      ],
      "schema_version": "2.0",
      "source_relpath": "general_sst/capacitaciones/politica_seguridad_trabajo/seguridad_vial/1768504433896_syc_1723156961461_syc_vial.pdf"
    }
  ],
  "run_id": "llama_pdf_after_semantic_fix_live",
  "schema_version": "2.0"
}
